number,value,state,params_batch_size,params_ctx_sample_mode,params_kl_warmup_epochs,params_lr,params_mask_fill,params_num_hidden,params_sensor_drop_mode,params_sensor_drop_p,params_weight_decay,user_attrs_mae_per_topology,user_attrs_objective_topologies,user_attrs_trial_dir
0,9.852407375971476,COMPLETE,16,first,500,0.0016409119617016143,zero,128,k_uniform,0.275034884505077,6.431172050131997e-05,{'ellipsoidal': 9.852407375971476},['ellipsoidal'],results/optuna/anp_masked_v2/trial_00000
1,115.90987260606555,COMPLETE,8,first,200,0.0037373255040743145,zero,128,k_uniform,0.41126270037994017,1.6334587611069488e-06,{'ellipsoidal': 115.90987260606555},['ellipsoidal'],results/optuna/anp_masked_v2/trial_00001
2,9.511299133300781,COMPLETE,32,first,800,0.001222381083098316,train_mean,32,bernoulli,0.2058222448418508,2.6919058249260712e-06,{'ellipsoidal': 9.511299133300781},['ellipsoidal'],results/optuna/anp_masked_v2/trial_00002
3,11.53295413123237,COMPLETE,8,first,600,0.001117255124590944,zero,128,k_uniform,0.37905247837090594,0.0006780227021579834,{'ellipsoidal': 11.53295413123237},['ellipsoidal'],results/optuna/anp_masked_v2/trial_00003
4,6.905008971691132,COMPLETE,16,first,500,0.00041489069053626246,zero,64,bernoulli,0.1835507024379339,5.1355896065002253e-05,{'ellipsoidal': 6.905008971691132},['ellipsoidal'],results/optuna/anp_masked_v2/trial_00004
5,12.795411626497906,COMPLETE,16,first,200,0.00015400118196017272,zero,32,k_uniform,0.4283972919391741,9.310837957239839e-05,{'ellipsoidal': 12.795411626497906},['ellipsoidal'],results/optuna/anp_masked_v2/trial_00005
6,72.4121265411377,COMPLETE,32,first,200,0.0010656495240313783,zero,192,bernoulli,0.218456079008858,0.00016511660035531799,{'ellipsoidal': 72.4121265411377},['ellipsoidal'],results/optuna/anp_masked_v2/trial_00006
7,5.545383585823905,COMPLETE,8,first,200,0.00028241566638334656,train_mean,128,k_uniform,0.22742758098052948,3.7131642495346186e-05,{'ellipsoidal': 5.545383585823905},['ellipsoidal'],results/optuna/anp_masked_v2/trial_00007
8,7.329882701237995,COMPLETE,16,first,200,0.00010818377152485235,train_mean,128,bernoulli,0.394077608849038,0.0003067750867937875,{'ellipsoidal': 7.329882701237995},['ellipsoidal'],results/optuna/anp_masked_v2/trial_00008
9,11.61444103717804,COMPLETE,16,first,700,0.004156157453966635,zero,64,bernoulli,0.4255191278809909,2.1947049130435382e-05,{'ellipsoidal': 11.61444103717804},['ellipsoidal'],results/optuna/anp_masked_v2/trial_00009
10,4.8238418473137745,COMPLETE,8,first,400,0.00031892216275936357,train_mean,192,k_uniform,0.10554703419633954,1.3110058873616402e-05,{'ellipsoidal': 4.8238418473137745},['ellipsoidal'],results/optuna/anp_masked_v2/trial_00010
11,5.353122652901544,COMPLETE,8,first,400,0.0003040898480954557,train_mean,192,k_uniform,0.1183404408442881,1.1537961836934187e-05,{'ellipsoidal': 5.353122652901544},['ellipsoidal'],results/optuna/anp_masked_v2/trial_00011
12,5.2145555390252,COMPLETE,8,first,400,0.0003862964872948665,train_mean,192,k_uniform,0.10176977010447508,7.368755321332321e-06,{'ellipsoidal': 5.2145555390252},['ellipsoidal'],results/optuna/anp_masked_v2/trial_00012
13,4.993017021814983,COMPLETE,8,first,400,0.0005331305233181273,train_mean,192,k_uniform,0.10629268207632454,6.3886990356784415e-06,{'ellipsoidal': 4.993017021814983},['ellipsoidal'],results/optuna/anp_masked_v2/trial_00013
14,5.467289098103842,COMPLETE,8,first,400,0.0007246639547619454,train_mean,160,k_uniform,0.4952665648773933,5.0561511829977685e-06,{'ellipsoidal': 5.467289098103842},['ellipsoidal'],results/optuna/anp_masked_v2/trial_00014
15,10.016149563259548,PRUNED,8,first,300,0.00019225866903844026,train_mean,160,k_uniform,0.15212523527514785,1.0005538638344018e-06,,,
16,,FAIL,8,first,400,0.0005901442829865061,train_mean,160,k_uniform,0.29943001090310406,1.4114682820325686e-05,,,
17,5.420271269480386,COMPLETE,8,first,600,0.0005855759646616387,train_mean,160,k_uniform,0.29169489522359165,1.5076714964185528e-05,{'ellipsoidal': 5.420271269480386},['ellipsoidal'],results/optuna/anp_masked_v2/trial_00017
18,64.61532878875732,PRUNED,32,first,300,0.000586382270376015,train_mean,192,k_uniform,0.15772545439622987,3.8327970312713715e-06,,,
19,123.93840467664931,PRUNED,8,first,600,0.0020130810306430436,train_mean,160,k_uniform,0.34619802950650175,1.0090824023866316e-05,,,
20,41.64074808756509,PRUNED,8,first,300,0.00022306928256685476,train_mean,96,k_uniform,0.26085525674118326,2.458102244706847e-05,,,
21,69.15057690938313,PRUNED,32,first,500,0.0007322278696922308,train_mean,192,k_uniform,0.1390431489411299,3.0061001632908874e-06,,,
22,42.331273396809905,PRUNED,8,first,400,0.0003645657323851359,train_mean,192,k_uniform,0.10299378117168599,6.2711486224892695e-06,,,
23,43.384480539957686,PRUNED,8,first,400,0.0004230309555941401,train_mean,160,k_uniform,0.11093348841261201,8.119360821564272e-06,,,
24,23.144174024793834,PRUNED,8,first,400,0.00046071586168665047,train_mean,192,k_uniform,0.16928206883605734,2.0140873364897148e-06,,,
25,50.80522740681966,PRUNED,8,first,300,0.00024371243286075013,train_mean,160,k_uniform,0.10195624329168847,1.595016544880967e-05,,,
26,58.52207717895507,PRUNED,8,first,500,0.00014762326618435257,train_mean,192,k_uniform,0.13519991455456218,6.250415918423234e-06,,,
27,9.014137522379558,PRUNED,8,first,400,0.000560907281885305,train_mean,96,bernoulli,0.19037002245208756,1.8920532390119645e-05,,,
28,24.481492953830294,PRUNED,8,first,300,0.0008658123329257045,train_mean,192,k_uniform,0.3339125551664736,3.3349846846412305e-05,,,
29,65.55371538798015,PRUNED,32,first,500,0.0003210547333093491,train_mean,160,k_uniform,0.24031571646739666,4.138968144434052e-06,,,
30,56.62103084988065,PRUNED,8,first,500,0.00016706655961002315,train_mean,192,k_uniform,0.13335085847244663,9.680015184193653e-05,,,
31,111.29873593648274,PRUNED,16,first,400,0.0020272023846204263,train_mean,160,k_uniform,0.18625561369652444,1.0430369493615073e-05,,,
32,50.59583189222548,PRUNED,8,first,400,0.00029642735116463273,train_mean,192,k_uniform,0.12520611665529963,1.1777620772903778e-05,,,
33,49.918972608778205,PRUNED,8,first,300,0.00024139583161159593,train_mean,192,k_uniform,0.1028302370287523,7.281349342034004e-06,,,
34,44.90515683492024,PRUNED,8,first,400,0.0005054794426326317,train_mean,192,k_uniform,0.16046718572076313,2.0341200318491633e-06,,,
35,22.912357245551217,PRUNED,8,first,500,0.00034226393053825803,zero,160,k_uniform,0.12509214693009385,1.3977348943497612e-05,,,
36,64.86755549112955,PRUNED,8,first,800,0.00010085226322878629,train_mean,192,k_uniform,0.2023744845817792,5.435247846263092e-05,,,
37,4.923967207802667,COMPLETE,8,first,600,0.000869405386222047,zero,160,bernoulli,0.16383798947084563,2.902876331277875e-06,{'ellipsoidal': 4.923967207802667},['ellipsoidal'],results/optuna/anp_masked_v2/trial_00037
38,70.75479189554851,PRUNED,32,first,700,0.0013758700795644136,zero,128,bernoulli,0.17151191628924262,1.176206251154691e-06,,,
39,37.78413319587708,PRUNED,16,first,700,0.0008586692992932319,zero,160,bernoulli,0.14643358559554598,2.906052309822912e-06,,,
40,13.546842299567327,PRUNED,8,first,600,0.0009155120090996565,zero,128,bernoulli,0.2567802147710875,1.568355739166316e-06,,,
41,64.28074942694771,PRUNED,8,first,600,0.0032595239870489836,zero,192,bernoulli,0.20489275536490273,3.9159476937627855e-06,,,
42,12.816146024068196,PRUNED,8,first,500,0.00037648083082155305,zero,192,bernoulli,0.11827297678435586,8.282397450465918e-06,,,
43,13.58288370768229,PRUNED,8,first,400,0.0006264334709000837,zero,192,bernoulli,0.12927552470633985,5.352606176463276e-06,,,
44,37.95204001532661,PRUNED,8,first,300,0.00046739605540073556,train_mean,160,k_uniform,0.10001953213509872,2.6399606559691887e-05,,,
45,12.346243286132813,PRUNED,8,first,400,0.0013165241000742214,zero,192,bernoulli,0.14681375707667835,2.4153608861277224e-06,,,
46,66.10136572519939,PRUNED,16,first,500,0.00028088747936334124,train_mean,64,k_uniform,0.17076861374489133,4.374769432682561e-05,,,
47,65.89177576700847,PRUNED,8,first,600,0.00019073903664659143,train_mean,32,k_uniform,0.11874461628047653,4.6395469408021205e-06,,,
48,60.10363252427842,PRUNED,8,first,500,0.0001264368580281509,zero,160,bernoulli,0.464710255039363,1.1009616159219405e-05,,,
49,63.38673909505208,PRUNED,32,first,400,0.0006592251998078806,train_mean,96,k_uniform,0.15021098863357804,1.953674953814515e-05,,,
50,76.70652389526366,PRUNED,8,first,300,0.0010281576092188982,train_mean,128,k_uniform,0.22845339850972934,0.0007469983804332449,,,
51,43.88828961054484,PRUNED,16,first,200,0.0004117392406350951,train_mean,192,k_uniform,0.17962506634875636,3.423734738862514e-06,,,
52,34.835497283935545,PRUNED,8,first,600,0.000554397055909912,train_mean,160,k_uniform,0.29217062004650257,1.4540596649240017e-05,,,
53,37.75360421074762,PRUNED,8,first,700,0.0007548126838855651,train_mean,128,k_uniform,0.33313849303287285,7.724732390233981e-06,,,
54,49.256701236301,PRUNED,8,first,600,0.00027466295393177613,train_mean,160,k_uniform,0.3623939418495752,2.6677419759399767e-05,,,
55,70.26023983425563,PRUNED,8,first,500,0.0005048635116441616,train_mean,192,k_uniform,0.30350358916279774,0.0005172919750075063,,,
56,38.37619726392958,PRUNED,8,first,700,0.00039665779175066364,train_mean,192,k_uniform,0.11934831142751301,5.706556837674171e-06,,,
57,30.647770945231116,PRUNED,8,first,400,0.0006948286026639251,train_mean,160,k_uniform,0.14226809079447145,1.736949769550786e-05,,,
58,52.38020451863607,PRUNED,8,first,600,0.00021337004583460466,train_mean,192,k_uniform,0.11435075315557525,9.293559200855024e-06,,,
59,58.177209536234535,PRUNED,32,first,500,0.00033564229295020417,zero,160,bernoulli,0.39955104394798474,1.3273261162572467e-05,,,
60,128.96552429199218,PRUNED,8,first,400,0.0016609700972532908,train_mean,192,k_uniform,0.15987524045974041,9.874569823418623e-05,,,
61,41.025584623548724,PRUNED,8,first,300,0.0007823203151985995,train_mean,160,k_uniform,0.13476120380638276,7.044680307737094e-05,,,
62,35.36300464206272,PRUNED,8,first,400,0.0011114998900917758,train_mean,160,k_uniform,0.48177527613946364,4.851727572571433e-06,,,
63,18.314390203687882,PRUNED,8,first,400,0.0005787686456714364,train_mean,128,k_uniform,0.4590800043576706,6.846806905824125e-06,,,
64,34.49792772928874,PRUNED,8,first,400,0.0004558134689650086,train_mean,192,k_uniform,0.43279682274227727,9.339310561323035e-06,,,
65,35.86022466023763,PRUNED,8,first,300,0.000498845462654449,train_mean,160,k_uniform,0.2767443452006564,2.465678664041908e-06,,,
66,19.914225472344288,PRUNED,8,first,500,0.000955766310060304,train_mean,192,k_uniform,0.10833418182537853,3.481628186913929e-06,,,
67,45.79314736260309,PRUNED,8,first,400,0.0002583412449385277,train_mean,160,k_uniform,0.1000187256716787,2.144415373659672e-05,,,
68,55.80778360366822,PRUNED,16,first,400,0.0008040014146972389,train_mean,192,k_uniform,0.3629521574779192,1.5579182080831758e-06,,,
69,38.25408838060168,PRUNED,8,first,800,0.000647037841613247,train_mean,192,bernoulli,0.31010115511137293,1.1765494335132275e-05,,,
70,63.750047047932945,PRUNED,32,first,500,0.00031802344982393777,zero,128,k_uniform,0.22105921741873868,5.821756030962215e-06,,,
71,37.167049407958984,PRUNED,8,first,600,0.00036841812574282676,train_mean,160,k_uniform,0.49694306238871355,4.344593974923237e-06,,,
72,52.137877739800345,PRUNED,8,first,300,0.0003100470518559591,train_mean,96,k_uniform,0.24490111318574906,3.942815283860862e-05,,,
73,53.337069617377395,PRUNED,8,first,200,0.0002275804721253216,train_mean,128,k_uniform,0.2720781460260872,1.5581934254865546e-05,,,
74,46.0559476216634,PRUNED,8,first,200,0.0004283387701964276,train_mean,160,k_uniform,0.1967263111523277,8.527695746377712e-06,,,
75,56.59407942030165,PRUNED,8,first,200,0.00017732767060699836,train_mean,192,k_uniform,0.1295649424660294,3.84242576769814e-05,,,
76,12.17784430185954,PRUNED,8,first,300,0.000542758327392054,train_mean,160,bernoulli,0.1769049320107951,2.984747832927847e-05,,,
77,42.570975155300566,PRUNED,8,first,600,0.00035500889563008564,zero,96,k_uniform,0.15904835632169537,6.829675706578047e-06,,,
78,43.08895679050022,PRUNED,8,first,700,0.00026220684896142445,train_mean,192,k_uniform,0.2141939621272851,1.2204155328378144e-05,,,
79,12.298426437377929,PRUNED,8,first,400,0.0006249018911352318,train_mean,160,bernoulli,0.11943107179030625,3.240557533079883e-06,,,
80,60.08334493637085,PRUNED,16,first,500,0.00020632322418995177,zero,192,k_uniform,0.1378836659657742,2.08097274330375e-05,,,
81,36.92287135654025,PRUNED,8,first,300,0.00044561273235927366,train_mean,128,k_uniform,0.32562811984723783,1.8924644892543753e-06,,,
82,55.750361601511635,PRUNED,16,first,500,0.0004033816882546039,zero,64,bernoulli,0.23372385946118732,5.5536608817105594e-05,,,
83,45.22985124588013,PRUNED,16,first,600,0.00028492701385614115,zero,96,bernoulli,0.10920195058130011,3.331944693568198e-05,,,
84,37.35741837819417,PRUNED,16,first,400,0.0005080368353778824,zero,64,bernoulli,0.1844763922789949,8.259524962448932e-05,,,
85,42.61187473932902,PRUNED,16,first,400,0.0007316382120929357,zero,32,bernoulli,0.1939724634520536,2.4141179051859583e-05,,,
86,63.62663586934407,PRUNED,32,first,600,0.0003427433838046276,zero,32,bernoulli,0.1509792067263271,0.00015243745489803306,,,
87,35.02742156982422,PRUNED,8,first,500,0.0008617956799339816,train_mean,64,k_uniform,0.24930846397879447,4.9069239197519675e-05,,,
88,46.10220548841687,PRUNED,8,first,400,0.00023741555205255676,train_mean,192,k_uniform,0.16366444900209634,5.046880601227119e-06,,,
89,54.14442873001099,PRUNED,16,first,500,0.00030128494878786904,zero,192,bernoulli,0.21162594715887229,1.0452630378656038e-05,,,
90,54.34104894002278,PRUNED,8,first,400,0.0003838175058776965,train_mean,160,k_uniform,0.1260253081245658,7.891423788114614e-06,,,
91,32.06248029073079,PRUNED,8,first,300,0.0006064612206422299,train_mean,128,k_uniform,0.11169093259657258,3.9486472335206325e-06,,,
92,77.70227527618408,PRUNED,16,first,200,0.0009871266142096682,train_mean,128,bernoulli,0.37018384759047906,0.0009504269501382323,,,
93,62.932234605153404,PRUNED,16,first,200,0.00048245475347202045,train_mean,128,bernoulli,0.39937967301448923,0.0003021776068505329,,,
94,72.56074937184653,PRUNED,16,first,200,0.00010221797614497892,train_mean,96,bernoulli,0.4222518663795704,0.00032282156269435714,,,
95,67.72789780298869,PRUNED,16,first,700,0.00013858945258310071,train_mean,128,bernoulli,0.4501780800309176,1.4104718489806905e-05,,,
96,47.77370003594293,PRUNED,8,first,200,0.0005651577708395841,train_mean,192,bernoulli,0.3950789642789884,0.00012508887248148046,,,
97,32.10084296332465,PRUNED,8,first,300,0.0007119547826859657,train_mean,128,k_uniform,0.2864245386131473,1.7230636017624268e-05,,,
98,61.2864662806193,PRUNED,32,first,500,0.0005345977859299774,train_mean,160,k_uniform,0.13865135291901348,6.205363421983121e-06,,,
99,124.8178990681966,PRUNED,8,first,400,0.0011638473523257241,zero,192,bernoulli,0.32158264459537733,0.0002452217715183841,,,
100,66.59135834376018,PRUNED,16,first,400,0.00011705406764533674,train_mean,192,k_uniform,0.10708627640572413,2.736473947338238e-06,,,
101,47.19703165690104,PRUNED,8,first,600,0.0001604672704865713,train_mean,160,k_uniform,0.35115441123301133,9.133844937861614e-06,,,
102,45.28458499908447,PRUNED,32,first,800,0.0016312471172175741,train_mean,32,bernoulli,0.3837419891062112,2.5937102116016586e-06,,,
103,45.885754903157554,PRUNED,32,first,800,0.0013210134285663927,train_mean,64,bernoulli,0.22410348226323007,2.086856344740462e-06,,,
104,48.43495559692383,PRUNED,32,first,700,0.0006849497451439296,train_mean,32,bernoulli,0.20586383377575368,6.780851994760196e-06,,,
105,50.79787635803222,PRUNED,32,first,400,0.0008108756960602067,train_mean,96,bernoulli,0.1875911416228779,1.1262421045425049e-06,,,
106,36.27812173631457,PRUNED,8,first,300,0.00042847248367315215,train_mean,192,k_uniform,0.2638171910380319,4.442264844007914e-06,,,
107,101.30433213975694,PRUNED,8,first,800,0.0016636981691637849,train_mean,128,bernoulli,0.17356963051177593,0.0005356576653829324,,,
108,22.156717469957137,PRUNED,8,first,400,0.0012280122007266232,zero,32,k_uniform,0.12359998795977792,3.209287134829752e-06,,,
109,125.88286654154459,PRUNED,32,first,500,0.003370880159653115,train_mean,192,k_uniform,0.14984484620197275,1.7658790045016695e-05,,,
110,98.76910569932728,PRUNED,8,first,700,0.0024282562035194246,train_mean,160,bernoulli,0.23621985904922402,5.649435672719565e-06,,,
111,41.019427702162005,PRUNED,8,first,200,0.0003379795834590153,train_mean,64,k_uniform,0.16778919920647717,3.663945277720401e-06,,,
112,112.97138404846191,PRUNED,16,first,400,0.001977466392980985,zero,128,k_uniform,0.3014598026310537,6.078659188784503e-05,,,
113,50.82008330027263,PRUNED,16,first,500,0.0009175414937755691,zero,128,k_uniform,0.28880404471276444,4.4253837557507275e-05,,,
114,51.97801160812378,PRUNED,16,first,600,0.0010441401067943048,zero,128,k_uniform,0.2766691637509149,2.857697846132387e-05,,,
115,50.97793451944987,PRUNED,16,first,400,0.0014485281096771648,zero,160,k_uniform,0.11726800388459227,3.74080667634807e-05,,,
116,125.46118354797363,PRUNED,16,first,400,0.0015210150778662537,zero,192,k_uniform,0.10255251412025546,6.950217559493601e-05,,,
117,125.95751444498698,PRUNED,8,first,500,0.0048237596798452196,train_mean,128,k_uniform,0.20101645229341608,1.1816672684266522e-05,,,
118,51.253343963623045,PRUNED,8,first,600,0.00037894258796896356,zero,160,k_uniform,0.31536509845746746,0.00011153262817609499,,,
119,39.63529078165689,PRUNED,8,first,500,0.001919957759364156,train_mean,96,bernoulli,0.26380580641623425,7.68006236963136e-06,,,
120,62.79826958974202,PRUNED,16,first,700,0.0002545736662925092,train_mean,192,k_uniform,0.2528158607521483,1.7484422135942169e-06,,,
121,41.64613791571723,PRUNED,8,first,400,0.00045645765017929187,zero,128,bernoulli,0.499500295635927,2.4113910685773694e-05,,,
122,126.39374677870008,PRUNED,8,first,600,0.0024792737725924676,zero,128,k_uniform,0.42367856949562216,0.0006613338302705832,,,
123,60.80554860432942,PRUNED,8,first,600,0.0012424066734847618,zero,128,k_uniform,0.3407521571751035,0.0004695244919538889,,,
124,44.64748382568359,PRUNED,8,first,500,0.0011135810009860838,zero,128,k_uniform,0.4792980792932237,0.0001770000929891491,,,
125,61.25401967366536,PRUNED,8,first,600,0.0007669565327356586,zero,160,k_uniform,0.41268076899709377,0.00037762606608302896,,,
126,81.42617085774738,PRUNED,8,first,200,0.0009035926466174467,train_mean,192,k_uniform,0.12955081595576656,0.0009222247743855477,,,
127,42.22177505493163,PRUNED,8,first,500,0.0003138661168004373,train_mean,128,k_uniform,0.17845754601983607,9.936426732047589e-06,,,
128,56.22231070200601,PRUNED,16,first,600,0.0002834225844134473,zero,192,k_uniform,0.4351403212491619,4.9433374802136185e-06,,,
129,45.399161974589035,PRUNED,32,first,400,0.0006129609267470562,train_mean,96,bernoulli,0.11174201576850941,2.1990260967574675e-06,,,
130,54.22771869235569,PRUNED,8,first,300,0.0004068007469369149,train_mean,160,k_uniform,0.21125576441531266,0.00020957680464623492,,,
131,51.15915111965604,PRUNED,8,first,500,0.00018168312544642116,zero,128,k_uniform,0.14390147517450594,4.6759718765362195e-05,,,
132,31.03651730219523,PRUNED,16,first,700,0.002701533646496655,zero,64,bernoulli,0.38625930448982976,2.12530336187483e-05,,,
133,37.315392653147384,PRUNED,16,first,800,0.0041576162202350934,zero,32,bernoulli,0.45143921058742975,1.341166991555872e-05,,,
134,53.70911916097005,PRUNED,16,first,700,0.0006762146800032004,zero,64,bernoulli,0.4743916569936744,3.561849737542884e-05,,,
135,46.41918150583903,PRUNED,16,first,600,0.000519864697091708,zero,96,bernoulli,0.40990729871484893,1.688882726433912e-05,,,
136,60.62480227152507,PRUNED,16,first,700,0.00036198015646235075,train_mean,64,bernoulli,0.2952774897360625,3.0301758837701372e-05,,,
137,43.938983154296885,PRUNED,8,first,600,0.00020899565618671422,train_mean,192,bernoulli,0.19197728195684668,1.571702986012708e-05,,,
138,47.31187786526151,PRUNED,8,first,800,0.0008575899668375565,zero,32,k_uniform,0.38510242155395374,1.4023000152311638e-06,,,
139,62.473340670267746,PRUNED,32,first,400,0.0010230830370407088,train_mean,128,k_uniform,0.22735736907218862,1.0843451341881886e-05,,,
140,54.66576306025186,PRUNED,16,first,200,0.0005665760614645429,train_mean,160,bernoulli,0.36948651205699984,7.559919012311584e-05,,,
141,47.46675864325629,PRUNED,8,first,400,0.00048512886082920857,zero,192,k_uniform,0.35463616206497167,5.4999551622609684e-05,,,
142,65.58560307820639,PRUNED,16,first,200,0.00014402455768755342,zero,32,k_uniform,0.4430676184599293,2.3530167810918285e-05,,,
143,73.29105027516684,PRUNED,16,first,200,0.00011297622085544546,zero,32,k_uniform,0.4255231912760958,6.285080070906779e-05,,,
144,92.14591948191324,PRUNED,16,first,200,0.0002296423209014777,zero,32,k_uniform,0.11998853963403877,8.521364014474293e-05,,,
145,121.77529780069987,PRUNED,16,first,200,0.00011916150364386687,zero,32,k_uniform,0.467964048228424,1.940211815851094e-05,,,
146,68.70460527208117,PRUNED,8,first,300,0.0001010271829232269,train_mean,64,k_uniform,0.10827789076929434,8.736768775445172e-06,,,
147,60.72766097386678,PRUNED,16,first,700,0.00013545979869552854,train_mean,192,bernoulli,0.40607803156990874,1.2729381808011959e-05,,,
148,52.051381174723296,PRUNED,8,first,400,0.00033351381972206265,zero,32,k_uniform,0.10157540498071553,7.0169369532773425e-06,,,
149,54.22108662923178,PRUNED,8,first,200,0.0002967869133791275,train_mean,128,k_uniform,0.4871958935242484,4.2414502202951714e-05,,,
150,30.433744033177693,PRUNED,16,first,800,0.0008000567898742148,train_mean,160,bernoulli,0.18353469831645391,2.873875727534639e-06,,,
151,76.36141268412273,PRUNED,32,first,600,0.0001521413795729145,zero,192,k_uniform,0.13257375438403055,0.0007363346645439407,,,
