number,value,state,params_batch_size,params_ctx_sample_mode,params_kl_warmup_epochs,params_lr,params_mask_fill,params_num_hidden,params_sensor_drop_mode,params_sensor_drop_p,params_weight_decay,user_attrs_mae_per_topology,user_attrs_objective_topologies,user_attrs_trial_dir
152,104.03650919596353,PRUNED,32,first,200,0.0011168456419104397,zero,192,bernoulli,0.21785978239869486,0.0002451969590756748,,,
153,66.52457237243652,PRUNED,32,first,200,0.0009496354499614885,zero,192,bernoulli,0.239547263758496,0.00012066998088098424,,,
154,105.34261004130046,PRUNED,32,first,200,0.00123781057506377,zero,192,bernoulli,0.28185138082791905,0.0001689434137094795,,,
155,115.46527290344238,PRUNED,32,first,200,0.0013711925941885554,zero,192,bernoulli,0.4170195493532546,8.548851539744639e-05,,,
156,40.097874196370434,PRUNED,8,first,500,0.0006414872148922672,train_mean,96,bernoulli,0.20848091535279525,0.00014680323070561424,,,
157,125.46376139322915,PRUNED,8,first,500,0.0010468451946644296,zero,192,k_uniform,0.19822398760341975,0.0003898133529549307,,,
158,43.49874894883897,PRUNED,8,first,400,0.00042763056734980664,train_mean,128,k_uniform,0.21963162451061224,5.113315615308118e-05,,,
159,123.85720030466715,PRUNED,16,first,300,0.0018013516747682208,zero,192,bernoulli,0.3106013761240979,9.971866988260599e-05,,,
160,68.55075009663899,PRUNED,32,first,200,0.0002669796412922157,train_mean,128,k_uniform,0.3952762513000937,1.4740452481181212e-05,,,
161,43.87831836276584,PRUNED,8,first,400,0.0007371218957581365,train_mean,160,bernoulli,0.4363944487697588,4.342035290636349e-06,,,
162,1249.4914388020832,PRUNED,8,first,200,0.0040961676063872325,zero,128,k_uniform,0.42899356801804095,5.632657425335182e-06,,,
163,119.01575741238065,PRUNED,8,first,200,0.003340143964268636,zero,128,k_uniform,0.4060810206245604,1.6973639009711357e-06,,,
164,125.10596839057077,PRUNED,8,first,200,0.004053060262981702,zero,128,k_uniform,0.44728062303227667,6.21553980079668e-05,,,
165,82.65737186008029,PRUNED,8,first,200,0.003708478573455137,zero,128,k_uniform,0.4589756942171369,1.2544108834303e-06,,,
166,127.14200185139974,PRUNED,8,first,600,0.004675756363326797,zero,128,k_uniform,0.4157595841459536,0.00022381107335663606,,,
167,52.51336908340454,PRUNED,16,first,500,0.0003928286109459843,train_mean,192,k_uniform,0.11449205661418149,3.7270256560628566e-06,,,
168,68.48024775187176,PRUNED,8,first,200,0.0001269483414018139,zero,32,k_uniform,0.391916397943704,0.0006097898569516449,,,
169,125.38512234157989,PRUNED,8,first,400,0.0036265107890608287,train_mean,160,bernoulli,0.1013640713875259,2.3579597666123685e-06,,,
170,63.06206989288331,PRUNED,16,first,600,0.00016602836116437437,zero,96,k_uniform,0.3729685980325441,2.660907626844987e-05,,,
171,126.29073672824434,PRUNED,8,first,300,0.0031115770950130286,train_mean,128,bernoulli,0.37627753131498065,3.3259897771575554e-05,,,
172,47.43979381985135,PRUNED,8,first,300,0.00019291795980477954,train_mean,160,k_uniform,0.15911119233220816,1.228263490228676e-06,,,
173,43.35560735066731,PRUNED,8,first,200,0.0002444637877669085,train_mean,160,k_uniform,0.16977716238925483,1.463356701711163e-06,,,
174,112.84365726047092,PRUNED,8,first,400,0.0022368867153510627,train_mean,160,k_uniform,0.15051968160445106,1.0638254454824706e-06,,,
175,42.40879753960504,PRUNED,8,first,300,0.00030745472357242645,train_mean,160,k_uniform,0.18850080697864924,1.7411503785807899e-06,,,
176,126.21693912082247,PRUNED,8,first,200,0.0029232382946510057,train_mean,192,k_uniform,0.229101080268749,1.0826865799954172e-05,,,
177,125.67235247294107,PRUNED,32,first,400,0.004443397283533015,train_mean,160,k_uniform,0.12384264484905545,9.607233615916825e-06,,,
178,41.56918064753214,PRUNED,16,first,200,0.0008813280471359795,zero,64,k_uniform,0.1350468445654979,7.835383940150731e-06,,,
179,65.18633261786567,PRUNED,8,first,400,0.0011583077159892706,train_mean,128,bernoulli,0.2691271612082452,0.0003126413399529476,,,
180,31.726039928860136,PRUNED,8,first,500,0.0003647871515831087,zero,192,k_uniform,0.40386144905832616,2.1234182523563667e-06,,,
181,57.417130152384445,PRUNED,16,first,600,0.0001981656358762683,train_mean,160,k_uniform,0.16366317553288415,6.280292828244486e-06,,,
182,12.071889601813421,PRUNED,8,first,400,0.0005950514456892374,train_mean,64,bernoulli,0.1840083562129694,1.705460714411232e-05,,,
183,18.290043979220922,PRUNED,8,first,400,0.0004769320418538249,train_mean,96,bernoulli,0.19459762696732108,1.9977191197814795e-05,,,
184,32.83661880493164,PRUNED,8,first,400,0.00051482755310933,train_mean,32,bernoulli,0.20301194746756554,1.3272153491181705e-05,,,
185,9.491013940175375,PRUNED,8,first,700,0.000574783593410932,train_mean,128,bernoulli,0.17152864095292591,3.1113998885697144e-06,,,
186,31.53348087734646,PRUNED,8,first,400,0.0006808563254117789,train_mean,64,bernoulli,0.29530243186573024,2.2167930297841637e-05,,,
187,33.09080098470052,PRUNED,8,first,800,0.00032898066228912034,zero,96,bernoulli,0.11150631140709835,7.438669680298572e-05,,,
188,63.10820611317953,PRUNED,32,first,500,0.00044562712470149157,train_mean,192,k_uniform,0.4192190124478218,1.0282963391661255e-06,,,
189,47.23236687978109,PRUNED,16,first,400,0.0008492803843353404,zero,128,k_uniform,0.33215222677642575,4.586826016864623e-05,,,
190,71.3651362101237,PRUNED,8,first,200,0.0014928527549547997,train_mean,192,bernoulli,0.48987057789395233,1.423567774299761e-06,,,
191,36.76589488983154,PRUNED,16,first,400,0.0009899816095710378,zero,128,k_uniform,0.17700268363293103,5.1005808889504456e-06,,,
192,8.141435676150852,PRUNED,8,first,700,0.0005721807926508763,train_mean,128,bernoulli,0.1886419193348193,3.0780326536640567e-06,,,
193,12.917527368333603,PRUNED,8,first,700,0.0006119238633453357,train_mean,128,bernoulli,0.20726170602625285,2.4310056928341813e-06,,,
194,13.85818369123671,PRUNED,8,first,800,0.0005360485791020627,train_mean,128,bernoulli,0.1894613074567088,3.470018548115028e-06,,,
195,9.966314972771539,PRUNED,8,first,700,0.0007185592681946182,train_mean,128,bernoulli,0.1984685235185481,2.5800545643057065e-06,,,
196,49.02499304877387,PRUNED,8,first,600,0.00015456011428777622,train_mean,128,bernoulli,0.24582178569464727,1.8553562304267422e-05,,,
197,47.104405890570746,PRUNED,8,first,500,0.00028661174605748574,train_mean,32,bernoulli,0.17886651559721417,4.194904921502368e-06,,,
198,47.19421276516384,PRUNED,8,first,200,0.0005443325425388139,train_mean,128,k_uniform,0.21320360112080664,3.949301056035258e-05,,,
199,63.40031433105469,PRUNED,32,first,400,0.00017834568463220165,zero,192,bernoulli,0.15410752476905382,1.9188189330006667e-06,,,
200,32.43015819125705,PRUNED,8,first,600,0.0006447907743640187,train_mean,96,k_uniform,0.10750610140759954,1.5476515095636428e-05,,,
201,71.20507462819417,PRUNED,16,first,200,0.00035006002036949414,zero,160,k_uniform,0.11855103261932662,0.0004884977852933816,,,
202,33.72705646091037,PRUNED,8,first,700,0.000488075075900507,train_mean,128,bernoulli,0.16304752043048984,3.1136243822946454e-06,,,
203,51.821852450900614,PRUNED,8,first,700,0.0005806017104164665,train_mean,128,bernoulli,0.17139181734623415,0.00041525704727030723,,,
204,4.882631874084472,COMPLETE,8,first,700,0.0005894559636621121,train_mean,128,bernoulli,0.182575989937512,3.098291618586418e-06,{'ellipsoidal': 4.882631874084472},['ellipsoidal'],results/optuna/anp_masked_v2/trial_00204
205,46.61896209716797,PRUNED,8,first,700,0.00010775809093985625,train_mean,128,bernoulli,0.14384504645372723,0.00012944725637745394,,,
206,24.694248029920793,PRUNED,8,first,700,0.0006809591989992494,train_mean,128,bernoulli,0.18914092741565755,2.9732348805442454e-06,,,
207,28.65014262729221,PRUNED,8,first,700,0.0012665324141227729,train_mean,128,bernoulli,0.4385651440107282,4.136359982812863e-06,,,
208,31.667177878485788,PRUNED,8,first,800,0.0007973735020337819,zero,160,k_uniform,0.10004729483818145,1.2270829618907627e-05,,,
209,47.568517367045075,PRUNED,16,first,500,0.004981097808131188,train_mean,32,bernoulli,0.19890454969257945,0.00019277519625888302,,,
210,54.499373287624785,PRUNED,8,first,400,0.00021621803322033825,train_mean,192,k_uniform,0.22086543463632421,3.7169013406512037e-06,,,
211,44.16116180419922,PRUNED,8,first,200,0.0010493220317509596,zero,128,bernoulli,0.282998107360168,0.00010300152036823014,,,
212,15.109219233194986,PRUNED,8,first,700,0.0005492045382725359,train_mean,128,bernoulli,0.17538495528367012,2.656838836258624e-06,,,
213,23.438105477227108,PRUNED,8,first,700,0.0005819751906427769,train_mean,128,bernoulli,0.1798590291162594,3.2494259602086665e-06,,,
214,22.85340974595812,PRUNED,8,first,700,0.0006367374750329383,train_mean,128,bernoulli,0.1871942572109609,2.1151118802590652e-06,,,
215,27.009068467881942,PRUNED,8,first,700,0.0005158192762435728,train_mean,128,bernoulli,0.1677319488217443,2.8857676881344716e-06,,,
216,29.59771122402615,PRUNED,8,first,700,0.0005986588310807566,train_mean,128,bernoulli,0.1932662191628837,4.888477396162546e-06,,,
